{
  "$schema": "https://json-schema.org/draft/2020-12/schema",
  "$id": "news_item.schema.json",
  "$defs": {
    "Channel": {
      "enum": [
        "rss",
        "html",
        "pdf",
        "api",
        "manual"
      ],
      "title": "Channel",
      "type": "string"
    },
    "Classification": {
      "additionalProperties": false,
      "properties": {
        "topics": {
          "description": "Тип события",
          "items": {
            "$ref": "#/$defs/Topic"
          },
          "minItems": 1,
          "title": "Topics",
          "type": "array"
        },
        "markers": {
          "description": "Маркеры для фильтров ленты, от 1 до 3, главный первым",
          "items": {
            "$ref": "#/$defs/Marker"
          },
          "title": "Markers",
          "type": "array"
        },
        "okved_codes": {
          "items": {
            "minLength": 1,
            "type": "string"
          },
          "title": "Okved Codes",
          "type": "array"
        },
        "segments": {
          "description": "Затронутые сегменты рынка из справочника ОКВЭД",
          "items": {
            "maxLength": 200,
            "minLength": 1,
            "type": "string"
          },
          "title": "Segments",
          "type": "array"
        },
        "industries": {
          "description": "Отрасли словами",
          "items": {
            "minLength": 1,
            "type": "string"
          },
          "title": "Industries",
          "type": "array"
        },
        "regions": {
          "items": {
            "minLength": 1,
            "type": "string"
          },
          "title": "Regions",
          "type": "array"
        },
        "countries": {
          "items": {
            "minLength": 1,
            "type": "string"
          },
          "title": "Countries",
          "type": "array"
        },
        "entities": {
          "items": {
            "minLength": 1,
            "type": "string"
          },
          "title": "Entities",
          "type": "array"
        },
        "sentiment": {
          "anyOf": [
            {
              "enum": [
                "positive",
                "negative",
                "neutral",
                "mixed"
              ],
              "type": "string"
            },
            {
              "type": "null"
            }
          ],
          "default": null,
          "title": "Sentiment"
        },
        "horizon": {
          "anyOf": [
            {
              "$ref": "#/$defs/Horizon"
            },
            {
              "type": "null"
            }
          ],
          "default": null,
          "description": "Когда скажется на бизнесе: days — сразу, weeks — в ближайшие недели, months — в пределах года, years — дольше"
        },
        "confidence": {
          "anyOf": [
            {
              "maximum": 1,
              "minimum": 0,
              "type": "number"
            },
            {
              "type": "null"
            }
          ],
          "default": null,
          "title": "Confidence"
        },
        "method": {
          "default": "llm",
          "description": "llm — разобрала модель, rules — запасной разбор по словарю",
          "enum": [
            "llm",
            "rules"
          ],
          "title": "Method",
          "type": "string"
        },
        "model": {
          "anyOf": [
            {
              "minLength": 1,
              "type": "string"
            },
            {
              "type": "null"
            }
          ],
          "default": null,
          "description": "Какая разрешённая модель разобрала",
          "title": "Model"
        }
      },
      "required": [
        "topics"
      ],
      "title": "Classification",
      "type": "object"
    },
    "Dedup": {
      "additionalProperties": false,
      "properties": {
        "content_hash": {
          "minLength": 1,
          "title": "Content Hash",
          "type": "string"
        },
        "cluster_id": {
          "anyOf": [
            {
              "maxLength": 200,
              "minLength": 1,
              "type": "string"
            },
            {
              "type": "null"
            }
          ],
          "default": null,
          "description": "Сюжет, в который склеены дубликаты",
          "title": "Cluster Id"
        },
        "duplicate_of": {
          "anyOf": [
            {
              "maxLength": 200,
              "minLength": 1,
              "type": "string"
            },
            {
              "type": "null"
            }
          ],
          "default": null,
          "title": "Duplicate Of"
        }
      },
      "required": [
        "content_hash"
      ],
      "title": "Dedup",
      "type": "object"
    },
    "FactStatus": {
      "enum": [
        "confirmed",
        "reported",
        "forecast",
        "assumption"
      ],
      "title": "FactStatus",
      "type": "string"
    },
    "Fragment": {
      "additionalProperties": false,
      "description": "Кусок текста, на который можно сослаться точно: абзац новости, раздел обзора.",
      "properties": {
        "id": {
          "maxLength": 200,
          "minLength": 1,
          "title": "Id",
          "type": "string"
        },
        "text": {
          "minLength": 1,
          "title": "Text",
          "type": "string"
        },
        "locator": {
          "anyOf": [
            {
              "minLength": 1,
              "type": "string"
            },
            {
              "type": "null"
            }
          ],
          "default": null,
          "description": "Страница, раздел или номер абзаца",
          "title": "Locator"
        }
      },
      "required": [
        "id",
        "text"
      ],
      "title": "Fragment",
      "type": "object"
    },
    "Horizon": {
      "enum": [
        "days",
        "weeks",
        "months",
        "years"
      ],
      "title": "Horizon",
      "type": "string"
    },
    "KeyFact": {
      "additionalProperties": false,
      "properties": {
        "id": {
          "maxLength": 200,
          "minLength": 1,
          "title": "Id",
          "type": "string"
        },
        "text": {
          "minLength": 1,
          "title": "Text",
          "type": "string"
        },
        "status": {
          "$ref": "#/$defs/FactStatus",
          "description": "confirmed — подтверждено источником, reported — со слов участника, forecast — прогноз, assumption — предположение"
        },
        "fragment_id": {
          "anyOf": [
            {
              "maxLength": 200,
              "minLength": 1,
              "type": "string"
            },
            {
              "type": "null"
            }
          ],
          "default": null,
          "title": "Fragment Id"
        },
        "who": {
          "description": "Участники: компании, ведомства, люди",
          "items": {
            "minLength": 1,
            "type": "string"
          },
          "title": "Who",
          "type": "array"
        },
        "when": {
          "anyOf": [
            {
              "minLength": 1,
              "type": "string"
            },
            {
              "type": "null"
            }
          ],
          "default": null,
          "description": "Когда произошло или вступит в силу",
          "title": "When"
        },
        "numbers": {
          "description": "Цифры факта, как в тексте: «14%», «3,3 млрд долларов»",
          "items": {
            "minLength": 1,
            "type": "string"
          },
          "title": "Numbers",
          "type": "array"
        },
        "source_says": {
          "anyOf": [
            {
              "minLength": 1,
              "type": "string"
            },
            {
              "type": "null"
            }
          ],
          "default": null,
          "description": "Для reported и forecast — чьи это слова или прогноз",
          "title": "Source Says"
        }
      },
      "required": [
        "id",
        "text",
        "status"
      ],
      "title": "KeyFact",
      "type": "object"
    },
    "Marker": {
      "description": "Маркер новости для фильтров ленты. Список закрыт: модель выбирает из него, а не\nпридумывает свои.",
      "enum": [
        "economy_rate",
        "fx",
        "regulation_taxes",
        "trade_duties",
        "commodities_prices",
        "logistics",
        "labor",
        "technology",
        "industry_event",
        "incident"
      ],
      "title": "Marker",
      "type": "string"
    },
    "MaterialKind": {
      "enum": [
        "news",
        "bank_analytics"
      ],
      "title": "MaterialKind",
      "type": "string"
    },
    "Source": {
      "additionalProperties": false,
      "properties": {
        "name": {
          "description": "Издание или подразделение банка",
          "minLength": 1,
          "title": "Name",
          "type": "string"
        },
        "channel": {
          "$ref": "#/$defs/Channel"
        },
        "url": {
          "anyOf": [
            {
              "format": "uri",
              "maxLength": 2083,
              "minLength": 1,
              "type": "string"
            },
            {
              "type": "null"
            }
          ],
          "default": null,
          "title": "Url"
        }
      },
      "required": [
        "name",
        "channel"
      ],
      "title": "Source",
      "type": "object"
    },
    "Topic": {
      "enum": [
        "key_rate",
        "inflation",
        "fx",
        "commodities",
        "trade",
        "logistics",
        "sanctions",
        "regulation",
        "taxes",
        "labor",
        "consumption",
        "debt_market",
        "macro",
        "industry",
        "regional",
        "company",
        "other"
      ],
      "title": "Topic",
      "type": "string"
    }
  },
  "additionalProperties": false,
  "description": "Единица ленты: внешняя новость или материал аналитики банка.",
  "properties": {
    "schema_version": {
      "const": "1.0",
      "default": "1.0",
      "title": "Schema Version",
      "type": "string"
    },
    "id": {
      "maxLength": 200,
      "minLength": 1,
      "title": "Id",
      "type": "string"
    },
    "kind": {
      "$ref": "#/$defs/MaterialKind"
    },
    "source": {
      "$ref": "#/$defs/Source"
    },
    "url": {
      "anyOf": [
        {
          "format": "uri",
          "maxLength": 2083,
          "minLength": 1,
          "type": "string"
        },
        {
          "type": "null"
        }
      ],
      "default": null,
      "title": "Url"
    },
    "title": {
      "minLength": 1,
      "title": "Title",
      "type": "string"
    },
    "image": {
      "anyOf": [
        {
          "format": "uri",
          "maxLength": 2083,
          "minLength": 1,
          "type": "string"
        },
        {
          "type": "null"
        }
      ],
      "default": null,
      "description": "Картинка статьи: из ленты или og:image; пусто, если нет",
      "title": "Image"
    },
    "published_at": {
      "format": "date-time",
      "title": "Published At",
      "type": "string"
    },
    "collected_at": {
      "format": "date-time",
      "title": "Collected At",
      "type": "string"
    },
    "language": {
      "default": "ru",
      "minLength": 1,
      "title": "Language",
      "type": "string"
    },
    "text": {
      "minLength": 1,
      "title": "Text",
      "type": "string"
    },
    "summary": {
      "anyOf": [
        {
          "minLength": 1,
          "type": "string"
        },
        {
          "type": "null"
        }
      ],
      "default": null,
      "title": "Summary"
    },
    "fragments": {
      "items": {
        "$ref": "#/$defs/Fragment"
      },
      "title": "Fragments",
      "type": "array"
    },
    "key_facts": {
      "items": {
        "$ref": "#/$defs/KeyFact"
      },
      "title": "Key Facts",
      "type": "array"
    },
    "classification": {
      "anyOf": [
        {
          "$ref": "#/$defs/Classification"
        },
        {
          "type": "null"
        }
      ],
      "default": null,
      "description": "Пусто, пока материал не прошёл классификацию"
    },
    "dedup": {
      "$ref": "#/$defs/Dedup"
    }
  },
  "required": [
    "id",
    "kind",
    "source",
    "title",
    "published_at",
    "collected_at",
    "text",
    "dedup"
  ],
  "title": "NewsItem",
  "type": "object"
}
