{
  "schema_version": "1.0",
  "id": "news:demo-key-rate",
  "kind": "news",
  "source": {"name": "Демо-лента", "channel": "rss", "url": "https://example.org/rss"},
  "url": "https://example.org/news/key-rate-hold",
  "title": "Банк России сохранил ключевую ставку на уровне 14%",
  "published_at": "2026-09-11T13:30:00+03:00",
  "collected_at": "2026-09-11T13:45:00+03:00",
  "language": "ru",
  "text": "11 сентября 2026 года совет директоров Банка России принял решение сохранить ключевую ставку на уровне 14% годовых. Это первая пауза в цикле смягчения после десяти последовательных снижений, начавшегося в июне 2025 года.",
  "summary": "ЦБ сохранил ставку 14% — первая пауза после десяти снижений подряд.",
  "fragments": [
    {
      "id": "p1",
      "text": "11 сентября 2026 года совет директоров Банка России принял решение сохранить ключевую ставку на уровне 14% годовых.",
      "locator": "абзац 1"
    }
  ],
  "key_facts": [
    {"id": "f1", "text": "Ключевая ставка сохранена на уровне 14% годовых", "status": "confirmed", "fragment_id": "p1"}
  ],
  "classification": {
    "topics": ["key_rate", "macro"],
    "segments": ["finance"],
    "industries": ["банки и кредитование"],
    "entities": ["Банк России"],
    "sentiment": "neutral",
    "horizon": "months",
    "confidence": 0.95,
    "method": "llm",
    "model": "deepseek-v4.1-flash"
  },
  "dedup": {"content_hash": "sha256:demo-key-rate", "cluster_id": "story:key-rate-2026-09"}
}
