{
  "schema_version": "1.0",
  "id": "bank:demo-key-rate-review",
  "kind": "bank_analytics",
  "source": {"name": "Центр макроэкономических исследований Альфа-Банка", "channel": "pdf"},
  "title": "Ключевая ставка ЦБ РФ: ставка без изменения на 14,0%, риторика стала жестче",
  "published_at": "2026-09-11T18:00:00+03:00",
  "collected_at": "2026-09-12T09:00:00+03:00",
  "language": "ru",
  "text": "Синтетический текст для примера контракта. Ставка сохранена, сигнал регулятора стал жёстче; пространство для дальнейшего снижения в ближайшие месяцы ограничено.",
  "fragments": [
    {
      "id": "s2",
      "text": "Пространство для дальнейшего снижения ставки в ближайшие месяцы ограничено.",
      "locator": "раздел «Прогноз»"
    }
  ],
  "key_facts": [
    {"id": "f1", "text": "Снижение ставки в ближайшие месяцы маловероятно", "status": "forecast", "fragment_id": "s2"}
  ],
  "classification": {"topics": ["key_rate", "debt_market"], "confidence": 0.9},
  "dedup": {"content_hash": "sha256:demo-key-rate-review"}
}
